{
  "$schema": "https://json-schema.org/draft/2020-12/schema",
  "$id": "https://vivero-control.local/contracts/schemas/list-manageable-journeys-result.schema.json",
  "title": "Resultado listarJornadasAdministrables",
  "type": "object",
  "additionalProperties": false,
  "required": ["jornadas", "jornadasCerrando", "jornadasCanceladas", "lineasCatalogo"],
  "properties": {
    "jornadas": {
      "type": "array",
      "items": {"$ref": "draft-journey-summary.schema.json"}
    },
    "jornadasCerrando": {
      "type": "array",
      "items": {"$ref": "closing-journey-summary.schema.json"}
    },
    "jornadasCanceladas": {
      "type": "array",
      "items": {"$ref": "cancelled-draft-journey-summary.schema.json"}
    },
    "lineasCatalogo": {
      "type": "array",
      "items": {"$ref": "draft-catalog-line.schema.json"}
    }
  }
}
