{
  "jornadas": [
    {
      "jornadaId": "JORNADA-BORRADOR-SUPERVISOR",
      "nombreVisible": "Borrador ficticio del supervisor",
      "estado": "BORRADOR",
      "creadorUsuarioId": "uid-supervisor",
      "creadorNombreVisible": "Supervisor ficticio",
      "version": 1,
      "cantidadLineas": 1,
      "lineaIds": ["LINEA-CATALOGO-LIBRE-1"],
      "creadaEn": "2026-07-15T12:00:00.000Z",
      "actualizadaEn": "2026-07-15T12:00:00.000Z"
    }
  ],
  "jornadasCerrando": [],
  "jornadasCanceladas": [],
  "lineasCatalogo": [
    {
      "lineaId": "LINEA-CATALOGO-LIBRE-1",
      "nombreVisible": "Linea libre de catalogo 1",
      "seleccionable": true,
      "ubicacion": {
        "vivero": "Vivero ficticio",
        "modulo": "Modulo ficticio 2",
        "cama": "Cama ficticia 2",
        "linea": "LINEA-CATALOGO-LIBRE-1",
        "nombreVisible": "Linea libre de catalogo 1",
        "orden": 92
      }
    },
    {
      "lineaId": "LINEA-CATALOGO-CERRANDO-1",
      "nombreVisible": "Linea retenida por cierre durable",
      "seleccionable": false,
      "motivoNoSeleccionable": "JORNADA_CERRANDO",
      "ubicacion": {
        "vivero": "Vivero ficticio",
        "modulo": "Modulo ficticio 4",
        "cama": "Cama ficticia 1",
        "linea": "LINEA-CATALOGO-CERRANDO-1",
        "nombreVisible": "Linea retenida por cierre durable",
        "orden": 401
      }
    }
  ]
}
